[
  {
    "school_id": "tsinghua",
    "school_name_zh": "清华大学",
    "school_name_en": "Tsinghua University",
    "city": "北京",
    "province": "北京",
    "project_985": true,
    "status": "covered",
    "notes": "First-round GitHub search on 2026-04-17 found a clear, actively maintained thesis template repository.",
    "templates": [
      {
        "name": "thuthesis",
        "repo": "tuna/thuthesis",
        "url": "https://github.com/tuna/thuthesis",
        "degree_types": [
          "undergraduate",
          "master",
          "doctoral",
          "postdoc"
        ],
        "official_status": "community",
        "maintenance_status": "active",
        "last_verified": "2026-04-17",
        "evidence": "Repository README describes it as the Tsinghua University thesis template supporting undergraduate, master, doctoral, and postdoctoral documents.",
        "github_metrics": {
          "stars": 5257,
          "last_commit_at": "2026-04-04T06:34:27Z",
          "last_synced_at": "2026-04-17T13:53:08Z"
        }
      }
    ]
  },
  {
    "school_id": "peking",
    "school_name_zh": "北京大学",
    "school_name_en": "Peking University",
    "city": "北京",
    "province": "北京",
    "project_985": true,
    "status": "unverified",
    "notes": "First-round GitHub search on 2026-04-17 did not surface a clear GitHub-hosted degree thesis template repository.",
    "templates": []
  },
  {
    "school_id": "renmin",
    "school_name_zh": "中国人民大学",
    "school_name_en": "Renmin University of China",
    "city": "北京",
    "province": "北京",
    "project_985": true,
    "status": "covered",
    "notes": "First-round GitHub search on 2026-04-17 found an older community thesis template candidate.",
    "templates": [
      {
        "name": "ructhesis",
        "repo": "ZebinWang/ructhesis",
        "url": "https://github.com/ZebinWang/ructhesis",
        "degree_types": [
          "unknown"
        ],
        "official_status": "community",
        "maintenance_status": "inactive",
        "last_verified": "2026-04-17",
        "evidence": "The historic collection repository lists ZebinWang/ructhesis as a Renmin University of China LaTeX thesis template.",
        "github_metrics": {
          "stars": 128,
          "last_commit_at": "2016-12-21T12:19:50Z",
          "last_synced_at": "2026-04-17T13:53:08Z"
        }
      }
    ]
  },
  {
    "school_id": "bnu",
    "school_name_zh": "北京师范大学",
    "school_name_en": "Beijing Normal University",
    "city": "北京",
    "province": "北京",
    "project_985": true,
    "status": "unverified",
    "notes": "First-round GitHub search on 2026-04-17 did not surface a clear GitHub-hosted degree thesis template repository.",
    "templates": []
  },
  {
    "school_id": "cau",
    "school_name_zh": "中国农业大学",
    "school_name_en": "China Agricultural University",
    "city": "北京",
    "province": "北京",
    "project_985": true,
    "status": "unverified",
    "notes": "First-round GitHub search on 2026-04-17 surfaced Cdmium/CAUTemplate, but the description indicates a course thesis template rather than a degree thesis template, so it is excluded.",
    "templates": []
  },
  {
    "school_id": "bit",
    "school_name_zh": "北京理工大学",
    "school_name_en": "Beijing Institute of Technology",
    "city": "北京",
    "province": "北京",
    "project_985": true,
    "status": "covered",
    "notes": "First-round GitHub search on 2026-04-17 found a clear, actively maintained thesis template repository.",
    "templates": [
      {
        "name": "BIThesis",
        "repo": "BITNP/BIThesis",
        "url": "https://github.com/BITNP/BIThesis",
        "degree_types": [
          "undergraduate",
          "master",
          "doctoral"
        ],
        "official_status": "community",
        "maintenance_status": "active",
        "last_verified": "2026-04-17",
        "evidence": "GitHub topics lists BITNP/BIThesis as a Beijing Institute of Technology LaTeX template collection including undergraduate and graduate thesis templates, updated in 2025.",
        "github_metrics": {
          "stars": 1085,
          "last_commit_at": "2026-04-04T00:02:54Z",
          "last_synced_at": "2026-04-17T13:53:08Z"
        }
      }
    ]
  },
  {
    "school_id": "buaa",
    "school_name_zh": "北京航空航天大学",
    "school_name_en": "Beihang University",
    "city": "北京",
    "province": "北京",
    "project_985": true,
    "status": "covered",
    "notes": "First-round GitHub search on 2026-04-17 found a clear thesis template repository.",
    "templates": [
      {
        "name": "BUAAThesis",
        "repo": "CheckBoxStudio/BUAAThesis",
        "url": "https://github.com/CheckBoxStudio/BUAAThesis",
        "degree_types": [
          "master",
          "doctoral"
        ],
        "official_status": "community",
        "maintenance_status": "unknown",
        "last_verified": "2026-04-17",
        "evidence": "Repository README states it is a Beihang graduate degree thesis template containing both Word and LaTeX versions and covering doctoral and master's dissertations.",
        "github_metrics": {
          "stars": 603,
          "last_commit_at": "2024-02-01T05:42:34Z",
          "last_synced_at": "2026-04-17T13:53:08Z"
        }
      }
    ]
  },
  {
    "school_id": "minzu",
    "school_name_zh": "中央民族大学",
    "school_name_en": "Minzu University of China",
    "city": "北京",
    "province": "北京",
    "project_985": true,
    "status": "unverified",
    "notes": "First-round GitHub search on 2026-04-17 did not surface a clear GitHub-hosted degree thesis template repository.",
    "templates": []
  },
  {
    "school_id": "nankai",
    "school_name_zh": "南开大学",
    "school_name_en": "Nankai University",
    "city": "天津",
    "province": "天津",
    "project_985": true,
    "status": "unverified",
    "notes": "First-round GitHub search on 2026-04-17 did not surface a clear GitHub-hosted degree thesis template repository.",
    "templates": []
  },
  {
    "school_id": "tju",
    "school_name_zh": "天津大学",
    "school_name_en": "Tianjin University",
    "city": "天津",
    "province": "天津",
    "project_985": true,
    "status": "covered",
    "notes": "First-round GitHub search on 2026-04-17 found older community thesis template repositories.",
    "templates": [
      {
        "name": "TJUThesisLatexTemplate",
        "repo": "xnth97/TJUThesisLatexTemplate",
        "url": "https://github.com/xnth97/TJUThesisLatexTemplate",
        "degree_types": [
          "master",
          "doctoral"
        ],
        "official_status": "community",
        "maintenance_status": "inactive",
        "last_verified": "2026-04-17",
        "evidence": "The historic collection repository lists xnth97/TJUThesisLatexTemplate as LaTeX templates for Tianjin University graduate thesis.",
        "github_metrics": {
          "stars": 153,
          "last_commit_at": "2024-05-28T16:52:28Z",
          "last_synced_at": "2026-04-17T13:53:08Z"
        }
      }
    ]
  },
  {
    "school_id": "dut",
    "school_name_zh": "大连理工大学",
    "school_name_en": "Dalian University of Technology",
    "city": "大连",
    "province": "辽宁",
    "project_985": true,
    "status": "covered",
    "notes": "First-round GitHub search on 2026-04-17 found at least one GitHub-hosted thesis template candidate.",
    "templates": [
      {
        "name": "DLUT_XeLaTeX_Template_For_Bachelor",
        "repo": "stevewongv/DLUT_XeLaTeX_Template_For_Bachelor",
        "url": "https://github.com/stevewongv/DLUT_XeLaTeX_Template_For_Bachelor",
        "degree_types": [
          "undergraduate"
        ],
        "official_status": "community",
        "maintenance_status": "unknown",
        "last_verified": "2026-04-17",
        "evidence": "The repository owner's GitHub profile pins DLUT_XeLaTeX_Template_For_Bachelor and describes it as a Dalian University of Technology undergraduate thesis LaTeX template.",
        "github_metrics": {
          "stars": 16,
          "last_commit_at": "2018-05-31T01:43:20Z",
          "last_synced_at": "2026-04-17T13:53:08Z"
        }
      }
    ]
  },
  {
    "school_id": "neu",
    "school_name_zh": "东北大学",
    "school_name_en": "Northeastern University",
    "city": "沈阳",
    "province": "辽宁",
    "project_985": true,
    "status": "covered",
    "notes": "First-round GitHub search on 2026-04-17 found at least one GitHub-hosted thesis template candidate.",
    "templates": [
      {
        "name": "NEU-Thesis",
        "repo": "sci-m-wang/NEU-Thesis",
        "url": "https://github.com/sci-m-wang/NEU-Thesis",
        "degree_types": [
          "unknown"
        ],
        "official_status": "community",
        "maintenance_status": "unknown",
        "last_verified": "2026-04-17",
        "evidence": "The repository owner's GitHub profile pins NEU-Thesis and describes it as Northeastern University China's thesis in LaTeX that can be imported into Overleaf.",
        "github_metrics": {
          "stars": 122,
          "last_commit_at": "2025-02-09T14:35:20Z",
          "last_synced_at": "2026-04-17T13:53:08Z"
        }
      }
    ]
  },
  {
    "school_id": "jlu",
    "school_name_zh": "吉林大学",
    "school_name_en": "Jilin University",
    "city": "长春",
    "province": "吉林",
    "project_985": true,
    "status": "covered",
    "notes": "First-round GitHub search on 2026-04-17 found an older thesis template repository.",
    "templates": [
      {
        "name": "jluthesis",
        "repo": "dartall/jluthesis",
        "url": "https://github.com/dartall/jluthesis",
        "degree_types": [
          "unknown"
        ],
        "official_status": "community",
        "maintenance_status": "inactive",
        "last_verified": "2026-04-17",
        "evidence": "The historic collection repository lists dartall/jluthesis as a Jilin University thesis template repository.",
        "github_metrics": {
          "stars": 5,
          "last_commit_at": "2009-03-07T12:55:19Z",